{
  "edition": "apple",
  "frameworkVersion": "0.1.3",
  "supportedPlatforms": [
    "iOS",
    "macOS"
  ],
  "nativeLanguage": "Swift",
  "nativeTools": [
    "Xcode",
    "Swift Package Manager",
    "SwiftLint",
    "XCTest"
  ],
  "publicProducts": [
    "ForsettiCore",
    "ForsettiPlatform",
    "ForsettiHostTemplate"
  ],
  "manifest": {
    "currentSchemaVersion": "1.1",
    "currentTemplateVersion": "1.1",
    "moduleTypes": [
      "service",
      "ui",
      "app"
    ],
    "requiredFields": [
      "schemaVersion",
      "manifestTemplateVersion",
      "moduleID",
      "displayName",
      "moduleVersion",
      "moduleType",
      "supportedPlatforms",
      "minForsettiVersion",
      "capabilitiesRequested",
      "entryPoint",
      "runtimeRequirements"
    ]
  },
  "capabilities": [
    "networking",
    "storage",
    "secure_storage",
    "file_export",
    "crypto_utilities",
    "telemetry",
    "routing_overlay",
    "ui_theme_mask",
    "toolbar_items",
    "view_injection",
    "shared_database",
    "authentication",
    "diagnostics",
    "api",
    "security"
  ],
  "dependencyRules": {
    "ForsettiCore": [
      "depends_on:nothing_in_repository",
      "must_not_import:ForsettiPlatform",
      "must_not_import:SwiftUI",
      "must_not_import:UIKit",
      "must_not_import:AppKit",
      "must_not_import:StoreKit"
    ],
    "ForsettiPlatform": [
      "depends_on:ForsettiCore",
      "must_not_import:ForsettiHostTemplate"
    ],
    "ForsettiHostTemplate": [
      "depends_on:ForsettiCore",
      "depends_on:ForsettiPlatform"
    ],
    "ConsumerModules": [
      "may_depend_on:public_products_only",
      "must_not_reference_other_modules_directly"
    ]
  },
  "verificationCommands": [
    "./Scripts/verify-forsetti-guardrails.sh",
    "xcodebuild -scheme ForsettiFramework-Package -destination 'generic/platform=iOS Simulator' build"
  ]
}
